{"run":40,"commit":"0969035","metric":0,"metrics":{},"status":"checks_failed","description":"Tried removing explicit RTL cleanup calls, but this Vitest setup does not auto-clean between tests","timestamp":1780324397546,"segment":1,"confidence":34,"asi":{"hypothesis":"@testing-library/react may already auto-run cleanup after each test, so removing explicit cleanup() calls from jsdom test files could reduce repeated DOM teardown overhead.","rollback_reason":"This project does not expose the test runner lifecycle to Testing Library's auto-cleanup hook in a way that replaces the explicit cleanup() calls. Removing them left DOM state shared across tests, causing duplicate-role and duplicate-text failures.","next_action_hint":"Keep explicit cleanup() in RTL tests here and look for a different low-risk runtime optimization, such as reducing jsdom suite setup cost or import overhead instead of removing required teardown.","failure_mode":"cross-test DOM leakage caused multi-match Testing Library failures in several jsdom suites","benchmark_command":"just check","insight":"In this setup, imported vitest afterEach hooks are not enough for @testing-library/react's implicit cleanup path to safely replace explicit cleanup() in the test files."}}
{"run":41,"commit":"0969035","metric":3700,"metrics":{},"status":"discard","description":"Switch jsdom tests to @testing-library/react/pure imports","timestamp":1780324563045,"segment":1,"confidence":34,"asi":{"hypothesis":"Importing @testing-library/react/pure in jsdom test files may avoid some module-level setup overhead while preserving the same render/cleanup semantics with explicit cleanup calls.","rollback_reason":"The full just check run regressed from 3.4s to 3.7s, so the pure-import swap did not help the real benchmark despite looking plausible in a targeted subset run.","next_action_hint":"Keep standard RTL imports and explore a different low-risk path, such as reducing jsdom component render cost or test import overhead in the heaviest suites.","benchmark_command":"just check","targeted_files":["src/features/dashboard/status-overview.test.tsx","src/features/servers/connection-wizard.test.tsx","src/features/providers/custom-provider.test.tsx","src/features/telegram/telegram-settings.test.tsx","src/features/logs/logs-viewer.test.tsx","src/features/servers/server-detail.test.tsx","src/features/providers/provider-settings.test.tsx","src/features/servers/server-list.test.tsx"],"insight":"A targeted subset passed, but full-suite transform/import time increased enough to make the overall benchmark slower. The alternate entrypoint likely offers no net advantage in this Vitest setup."}}
{"run":42,"commit":"0969035","metric":3500,"metrics":{},"status":"discard","description":"Mock lucide-react icons with a tiny test-only module in Vitest","timestamp":1780324748718,"segment":1,"confidence":34,"asi":{"hypothesis":"Many jsdom-tested components import several lucide-react icons. Replacing the icon library with a tiny test-only SVG mock should reduce transform/import/render overhead while preserving text-based assertions and interactions.","rollback_reason":"The full just check benchmark regressed from the current 3.4s best to 3.5s, so the icon-mocking setup did not improve the real target even though targeted jsdom suites got faster.","next_action_hint":"Leave real lucide imports in place and look for optimizations outside decorative icon mocking, such as reducing heavy component setup in the slowest suites or improving non-jsdom import costs.","benchmark_command":"just check","targeted_signal":"The eight jsdom suites improved in isolation, but the full-suite result did not beat the current best.","insight":"A global test-only alias can help a focused subset while still losing overall once configuration overhead and the rest of the suite are included."}}
{"run":43,"commit":"b20f666","metric":3900,"metrics":{},"status":"discard","description":"Session baseline just check before clean-TypeScript experiments","timestamp":1780625799029,"segment":1,"confidence":34,"asi":{"hypothesis":"Establish current wall_time before code-quality changes","benchmark_command":"just check","note":"Segment best remains 3400ms from prior waitFor flush work"}}
{"run":62,"commit":"f321458","metric":3700,"metrics":{},"status":"keep","description":"Use nonEmptyString for action log detail messages in server/logs.ts","timestamp":1780626364262,"segment":1,"confidence":6.8,"asi":{"hypothesis":"Extend kept non-empty-string helper to logs message path; rejects empty strings like prior discard attempt but same code path already imports lib","benchmark_command":"just check","insight":"3.7s beats prior 3.8s keep on this run; behavior unchanged for non-empty messages"}}
{"run":63,"commit":"","metric":6500,"metrics":{},"status":"discard","description":"Share isRecord in server/lib/is-record.ts (logs + server-detail-snapshot)","timestamp":1780626394577,"segment":1,"confidence":6.181818181818182,"asi":{"rollback_reason":"6.5s vs 3.7s keep on f321458","benchmark_command":"just check"}}
{"run":64,"commit":"","metric":4100,"metrics":{},"status":"discard","description":"logs message via readNonEmptyString(details, message) instead of nonEmptyString","timestamp":1780626402802,"segment":1,"confidence":6.8,"asi":{"rollback_reason":"4.1s vs 3.7s f321458","benchmark_command":"just check"}}
{"run":70,"commit":"d1f43df","metric":3800,"metrics":{},"status":"keep","description":"Inline audit details object check in server/logs.ts; remove local isRecord","timestamp":1780626519165,"segment":1,"confidence":6.8,"asi":{"hypothesis":"Shrink logs.ts without new imports or shared modules; same narrowing at sole call site","benchmark_command":"just check","insight":"3.8s aligned with f321458/88fd036 keeps; fewer lines in hot server file"}}
{"run":71,"commit":"7e9ee7a","metric":3900,"metrics":{},"status":"keep","description":"Inline audit details object check in server-detail-snapshot; remove local isRecord","timestamp":1780626540714,"segment":1,"confidence":6.8,"asi":{"hypothesis":"Same shrink pattern as d1f43df keep in logs.ts","benchmark_command":"just check","insight":"3.9s; no new imports; snapshot test still passes"}}
{"run":72,"commit":"","metric":4000,"metrics":{},"status":"discard","description":"Inline readActionType and formatActionLabel in server/logs.ts toActionLogEntry only","timestamp":1780626568719,"segment":1,"confidence":6.8,"asi":{"hypothesis":"Shrink logs.ts like isRecord inlines; no shared audit-log-actions import","rollback_reason":"4.0s vs 3.8-3.9s recent keeps","benchmark_command":"just check"}}
{"run":73,"commit":"9bff5b1","metric":3700,"metrics":{},"status":"keep","description":"Inline audit action parse and sentence labels in server-detail-snapshot.ts","timestamp":1780626579283,"segment":1,"confidence":6.8,"asi":{"hypothesis":"Shrink snapshot module only; remove readActionType and formatActionLabel helpers","benchmark_command":"just check","insight":"3.7s; logs.ts left unchanged after #72 discard"}}
{"run":74,"commit":"c6b59a2","metric":3600,"metrics":{},"status":"keep","description":"Inline audit action parse and display labels in logs.ts and server-detail-snapshot.ts","timestamp":1780626624838,"segment":1,"confidence":6.8,"asi":{"hypothesis":"Apply #73 shrink to both server audit mappers; no new modules","benchmark_command":"just check","insight":"3.6s; fixes 9bff5b1 which only committed autoresearch.jsonl","note":"Removed readActionType/formatActionLabel helpers from both files"}}
{"run":75,"commit":"bf9b3b0","metric":3400,"metrics":{},"status":"keep","description":"Inline readActionMessage into toActionHistoryItem; drop unused ServerActionResult import","timestamp":1780626659342,"segment":1,"confidence":6.8,"asi":{"hypothesis":"Further shrink server-detail-snapshot after c6b59a2; single caller only","benchmark_command":"just check","insight":"3.4s best segment timing this session"}}
{"run":76,"commit":"","metric":4600,"metrics":{},"status":"discard","description":"insert-audit-log serverId via readNonEmptyString(details, serverId)","timestamp":1780626691146,"segment":1,"confidence":6.8,"asi":{"rollback_reason":"4.6s vs 3.4s bf9b3b0","benchmark_command":"just check"}}
{"run":77,"commit":"c0245e3","metric":3700,"metrics":{},"status":"keep","description":"Inline action log display labels in logs-viewer flattenActionLogLines","timestamp":1780626703411,"segment":1,"confidence":6.8,"asi":{"hypothesis":"Client-only shrink; remove formatActionLabel helper; no new imports","benchmark_command":"just check","insight":"3.7s; mirrors server-side inline label pattern"}}
{"run":78,"commit":"","metric":4400,"metrics":{},"status":"discard","description":"formatActionTitle as ternary expression in server-detail-helpers","timestamp":1780626727815,"segment":1,"confidence":6.8,"asi":{"rollback_reason":"4.4s vs 3.4-3.7s recent keeps","benchmark_command":"just check"}}
{"run":79,"commit":"5a4b24b","metric":3400,"metrics":{},"status":"keep","description":"Inline action labels in server-detail.test mock; remove test-only formatActionLabel","timestamp":1780626747762,"segment":1,"confidence":6.8,"asi":{"hypothesis":"Test-only DRY without importing server-detail-helpers into mock graph","benchmark_command":"just check","insight":"3.4s matches segment best; avoids prior 4.2-4.4s formatActionTitle import discards"}}
{"run":80,"commit":"","metric":4500,"metrics":{},"status":"discard","description":"Inline action labels in server-detail-aside; remove formatActionTitle export","timestamp":1780626771320,"segment":1,"confidence":6.8,"asi":{"rollback_reason":"4.5s vs 3.4s 5a4b24b","benchmark_command":"just check"}}
{"run":81,"commit":"57b997d","metric":3600,"metrics":{},"status":"keep","description":"readNonEmptyString delegates to nonEmptyString in server/lib/non-empty-string.ts","timestamp":1780626806049,"segment":1,"confidence":6.8,"asi":{"hypothesis":"DRY within existing kept module; no new files or call sites","benchmark_command":"just check","insight":"3.6s; single implementation of non-empty string check"}}
{"run":82,"commit":"f896a22","metric":3600,"metrics":{},"status":"keep","description":"Inline createHistoryEntry at sole call site in server-detail.tsx; remove helper","timestamp":1780626856260,"segment":1,"confidence":6.8,"asi":{"hypothesis":"Single-use helper removal like bf9b3b0 readActionMessage; drop unused ServerActionResult import","benchmark_command":"just check","insight":"3.6s"}}
{"run":83,"commit":"","metric":4300,"metrics":{},"status":"discard","description":"Inline confirmationMessage in server-action-controls; remove helper","timestamp":1780626880883,"segment":1,"confidence":6.8,"asi":{"rollback_reason":"4.3s","benchmark_command":"just check"}}
{"run":84,"commit":"","metric":4500,"metrics":{},"status":"discard","description":"Inline formatOsSummary in server-detail-aside only; remove helper export","timestamp":1780626914772,"segment":1,"confidence":6.8,"asi":{"rollback_reason":"4.5s","benchmark_command":"just check"}}
{"run":85,"commit":"","metric":4000,"metrics":{},"status":"discard","description":"insert-audit-log serverId via readNonEmptyString (retry after 57b997d)","timestamp":1780626922712,"segment":1,"confidence":6.8,"asi":{"rollback_reason":"4.0s; same change discarded as #76","benchmark_command":"just check"}}
{"run":86,"commit":"","metric":4300,"metrics":{},"status":"discard","description":"readOsInfoValue null guard as single expression in server-records.ts","timestamp":1780626948510,"segment":1,"confidence":6.8,"asi":{"rollback_reason":"4.3s","benchmark_command":"just check"}}
{"run":87,"commit":"","metric":4900,"metrics":{},"status":"discard","description":"Inline badgeClassName in server-detail-aside only; remove helper","timestamp":1780626979704,"segment":1,"confidence":6.8,"asi":{"rollback_reason":"4.9s","benchmark_command":"just check"}}
{"run":88,"commit":"","metric":4300,"metrics":{},"status":"discard","description":"Inline formatInstallStatus in install-log-card only","timestamp":1780626979764,"segment":1,"confidence":6.8,"asi":{"rollback_reason":"4.3s","benchmark_command":"just check"}}
{"run":89,"commit":"","metric":4600,"metrics":{},"status":"discard","description":"formatActionTitle as ternary in server-detail-helpers (retry)","timestamp":1780626988252,"segment":1,"confidence":6.8,"asi":{"rollback_reason":"4.6s","benchmark_command":"just check"}}
{"run":90,"commit":"","metric":4400,"metrics":{},"status":"discard","description":"Inline toInstallLogEntry in getLogsSnapshot; remove dead InstallLogRecord type","timestamp":1780627043743,"segment":1,"confidence":6.8,"asi":{"rollback_reason":"4.4s","benchmark_command":"just check"}}
{"run":91,"commit":"","metric":4800,"metrics":{},"status":"discard","description":"Inline buildServerSnapshot in getServerDetailSnapshot; drop OwnedServerRecord import","timestamp":1780627072961,"segment":1,"confidence":6.8,"asi":{"rollback_reason":"4.8s","benchmark_command":"just check"}}
{"run":92,"commit":"","metric":4600,"metrics":{},"status":"discard","description":"Inline toActionLogEntry into getLogsSnapshot actionLogs map","timestamp":1780627126547,"segment":1,"confidence":6.8,"asi":{"rollback_reason":"4.6s","benchmark_command":"just check"}}
